Name,Year,Genres,Budget,domestic_gross,foreign_gross,worldwide_gross
dambé: the mali project,2008.0,"music, musical, documentary",,,,
dame chance,1926.0,"romance film, drama",,,,
dames,1934.0,"black-and-white, musical comedy, musical, pre-code, comedy, romance film",,,,
dames and dentists,1920.0,"short film, silent film, indie, black-and-white",,,,
damien: omen ii,1978.0,"thriller, demonic child, horror, supernatural, cult, mystery, crime thriller",,,,
damini,1993.0,bollywood,,,,
dammu,2012.0,action,,,,
damn good dog,2004.0,documentary,,,,
damn yankees,1958.0,"sports, musical, fantasy, comedy",,,,
damnation alley,1977.0,"science fiction, doomsday film, road movie, apocalyptic and post-apocalyptic fiction, disaster, action, dystopia",17000000.0,,,
damned - the strange world of josé mojica marins,2001.0,"indie, documentary",,,,
damon's law,1987.0,action,,,,
damsels in distress,2011.0,"romantic comedy, romance film, drama, comedy",3000000.0,,,
damul,1985.0,drama,,,,
dan finnerty & the dan band:i am woman,2005.0,comedy,,,,
dan in real life,2007.0,"romantic comedy, comedy-drama, drama, comedy, romance film, domestic comedy",,,,
dan morgan,1911.0,"silent film, drama",,,,
dana paani,1989.0,"crime fiction, action, drama",,,,
dance 'til dawn,1988.0,"romantic comedy, family film, comedy, teen",,,,
dance band,1935.0,"music, romance film, comedy film",,,,
dance craze,1981.0,"music, documentary",,,,
dance dance,1987.0,musical,,,,
dance hall racket,1953.0,crime fiction,,,,
dance in the rain,1961.0,drama,,,,
dance lexie dance,1996.0,short film,,,,
dance macabre,1992.0,horror,,,,
dance madness,1926.0,silent film,,,,
dance me outside,1994.0,"ensemble film, drama, indie, film adaptation",,,,
dance me to my song,1998.0,drama,,,,
dance of a dream,2001.0,"romantic comedy, world cinema, musical, comedy, romance film, chinese movies",,,,
dance of death,1969.0,"drama, film adaptation",,,,
dance of fire,1949.0,comedy film,,,,
dance of ganesha,2011.0,"short film, drama",,,,
dance of the dead,2005.0,"cult, zombie film, horror, television movie",,,,
dance of the dead,2008.0,"zombie film, horror, indie, teen, comedy",,,,
dance of the drunk mantis,1979.0,"dogme 95, world cinema, action comedy, action/adventure, martial arts film, comedy, action, chinese movies",,,,
dance of the dwarfs,1983.0,"horror, fantasy, filipino movies, adventure",,,,
dance of the wind,1997.0,"music, drama, art film",,,,
dance on the volcano,1920.0,"silent film, indie, black-and-white",,,,
dance party usa,2006.0,"drama, indie",,,,
dance pretty lady,1932.0,drama,,,,
dance star,2010.0,musical,,,,
dance to the spirits,2009.0,documentary,,,,
dance with a stranger,1985.0,"crime fiction, biography, docudrama, period piece, drama, biopic [feature], courtroom drama",,,,
dance with me,1998.0,"romantic drama, romance film, drama, comedy",,,,
dance with me henry,1956.0,"family film, comedy, black-and-white, slapstick",,,,
dance with the wind,2004.0,romantic comedy,,,,
dance! workout with barbie,1992.0,short film,,,,
"dance, fools, dance",1931.0,"crime fiction, drama, pre-code, black-and-white",,,,
"dance, girl, dance",1940.0,"black-and-white, musical, drama, comedy, romantic drama, romance film",,,,
dancehall queen,1997.0,"crime fiction, melodrama, drama, world cinema",,,,
dancer,1991.0,"romantic drama, romance film, drama, world cinema",,,,
dancer,2005.0,,,,,
"dancer, texas pop. 81",1998.0,"indie, slice of life story, americana, comedy-drama, coming of age, comedy, drama, family film",2300000.0,,,
dancers,1987.0,drama,,,,
dancers in the dark,1932.0,"musical, drama, romance film",,,,
dances of the kwakiutl,1951.0,"short film, documentary",,,,
dances with wolves,1990.0,"adventure, epic western, costume drama, indian western, film adaptation, epic, action/adventure, revisionist western, western, drama, period piece, war film",19000000.0,,,
dancin' it's on,2015.0,,12000000.0,,,
dancin' thru the dark,1990.0,comedy,,,,
dancing at lughnasa,1998.0,"period piece, drama, indie, world cinema",,,,
dancing at the blue iguana,2000.0,"crime fiction, ensemble film, erotic drama, indie, drama, romantic drama, romance film, erotica",,,,
dancing at the harvest moon,2002.0,"romance film, drama",,,,
dancing co ed,1939.0,"romance film, comedy",,,,
dancing darkies,1896.0,"short film, silent film, documentary",,,,
dancing for oliver,2006.0,documentary,,,,
dancing girls,1896.0,silent film,,,,
dancing in september,2000.0,"romantic comedy, parody, television movie, comedy-drama, drama, comedy, media satire, romance film",,,,
dancing in the dark,1949.0,musical,,,,
dancing in the dark,1986.0,drama,,,,
dancing in the dust,1989.0,comedy,,,,
dancing lady,1933.0,"romantic comedy, backstage musical, black-and-white, musical, pre-code, comedy, romance film",,,,
dancing lion,2007.0,"chinese movies, comedy-drama, workplace comedy, world cinema, comedy",,,,
dancing mad,1925.0,"comedy film, drama, silent film",,,,
dancing mothers,1926.0,silent film,,,,
dancing ninja,2010.0,"crime fiction, action, martial arts film, comedy",,,,
dancing pirate,1936.0,musical,,,,
dancing queen,2012.0,"romance film, comedy film, drama, family film",,,,
dancing romeo,1944.0,"short film, family film, comedy, black-and-white",,,,
dancing with crime,1947.0,"crime fiction, mystery, drama",,,,
dancing with the pros,2005.0,"short film, biographical film, comedy",,,,
dancing with time,2007.0,documentary,,,,
dandelion,2004.0,"romance film, tragedy, drama, indie, romantic drama",,,,
dandelion dead,1994.0,"crime fiction, courtroom drama, drama, whodunit, crime drama",,,,
dandelion game,1998.0,family film,,,,
dandelion wine,1997.0,"science fiction, adventure",,,,
dandupalya,2012.0,crime fiction,,,,
dandy dick,1935.0,"comedy, black-and-white",,,,
dane cook: vicious circle,2006.0,"concert film, comedy, stand-up comedy, television movie",,,,
dang bireley's and young gangsters,1997.0,crime fiction,,,,
dangal,2016.0,,9500000.0,12391761.0,291331875.0,303723636.0
danger,2005.0,thriller,,,,
danger beneath the sea,2001.0,"thriller, action/adventure, action thrillers, action, television movie",,,,
danger flight,1939.0,"action/adventure, action, adventure, juvenile delinquency film, ""childrens/family""",,,,
danger island,1992.0,"horror, adventure",,,,
danger lights,1930.0,"romantic drama, romance film, drama, black-and-white",,,,
danger list,1959.0,short film,,,,
danger on dartmoor,1980.0,drama,,,,
danger on the air,1938.0,mystery,,,,
danger route,1967.0,"thriller, action/adventure, drama, film adaptation, action, spy",,,,
danger signal,1945.0,"crime fiction, drama, black-and-white, film noir",,,,
danger tomorrow,1960.0,crime fiction,,,,
danger valley,1937.0,"western, musical, action, drama, adventure",,,,
danger within,1958.0,"black-and-white, war film",,,,
danger zone,1997.0,"thriller, action, adventure",,,,
danger – love at work,1937.0,screwball comedy,,,,
danger!! death ray,1967.0,"science fiction, spy",,,,
"danger, go slow",1918.0,"silent film, indie, black-and-white, comedy",,,,
danger: diabolik,1968.0,"crime fiction, thriller, world cinema, superhero movie, caper story, master criminal films, superhero, action/adventure, action",,,,
dangerous,1935.0,"drama, black-and-white",,,,
dangerous beauty,1998.0,"costume drama, biopic [feature], period piece, drama, film adaptation, romantic drama, romance film, feminist film, biographical film",,,,
dangerous cargo,1954.0,"crime fiction, drama",,,,
dangerous child,2001.0,"crime fiction, family drama, drama, psychological thriller, television movie",,,,
dangerous crossing,1953.0,"thriller, mystery, drama, film noir",,,,
dangerous curves,1929.0,black-and-white,,,,
dangerous curves,1989.0,comedy film,,,,
dangerous dan mcfoo,1939.0,"short film, family film, comedy, animation",,,,
dangerous exile,1957.0,"historical fiction, action, drama, adventure, film adaptation",,,,
dangerous for your life!,1985.0,comedy film,,,,
dangerous game,1993.0,"drama, indie",,,,
dangerous game,1987.0,"thriller, horror, drama",,,,
dangerous game,1982.0,"crime fiction, mystery",,,,
dangerous ground,1997.0,"crime fiction, drama, political drama, indie",,,,
dangerous hours,1919.0,"romantic drama, silent film, drama, political drama, black-and-white",,,,
dangerous ishq,2012.0,"thriller, romance film, horror",,,,
dangerous liaisons,2012.0,"mystery, romance film, drama",24200000.0,,,
dangerous liaisons,1988.0,"costume drama, period piece, drama, comedy, film adaptation, romantic drama, romance film",24200000.0,,,
dangerous lies,1921.0,"silent film, drama, indie, black-and-white",,,,
dangerous living: coming out in the developing world,2003.0,"lgbt, documentary",,,,
dangerous medicine,1938.0,"crime fiction, drama",,,,
dangerous minds,1995.0,"crime fiction, thriller, drama, biopic [feature], biographical film, teen",,,,
dangerous mission,1954.0,"crime fiction, crime thriller, drama, thriller, mystery",,,,
dangerous money,1946.0,"thriller, mystery, crime fiction, comedy",,,,
dangerous moonlight,1941.0,"drama, adventure, black-and-white, war film",,,,
dangerous nan mcgrew,1930.0,"western, romance film, comedy film",,,,
dangerous parking,2007.0,drama,,,,
dangerous passage,1944.0,"thriller, black-and-white, action/adventure, drama, crime thriller, romantic drama, romance film, action",,,,
dangerous seas,1931.0,crime fiction,,,,
dangerous summer,2000.0,"period piece, drama",,,,
dangerous to know,1938.0,"crime fiction, mystery",,,,
dangerous touch,1994.0,"thriller, erotic thriller, drama",,,,
dangerous when wet,1953.0,"romantic comedy, romance film, comedy, musical, musical comedy",,,,
dangerously close,1986.0,"action thrillers, thriller, action, drama",,,,
dangerously they live,1941.0,"thriller, romance film, drama, war film",,,,
dangers of a bride,1917.0,"short film, silent film, black-and-white",,,,
dangers of the canadian mounted,1948.0,"action, adventure, black-and-white",,,,
daniel,1983.0,"crime fiction, drama, political drama, film adaptation",,,,
daniel,1970.0,comedy,,,,
daniel amos live in anaheim 1985,2003.0,,,,,
daniel and the towers,1987.0,"family drama, drama, television movie",,,,
daniel boone,1936.0,"western, historical fiction, adventure",,,,
"daniel boone, trail blazer",1956.0,"action/adventure, western, biography, adventure, period piece",,,,
daniel dafoe's robinson crusoe,1997.0,"adventure, costume drama, action/adventure, period piece, drama, film adaptation",,,,
daniel deronda,1921.0,"romance film, drama, silent film",,,,
daniel deronda,2002.0,,,,,
daniel tosh: completely serious,2007.0,"comedy, stand-up comedy",,,,
daniel – der zauberer,2004.0,"biographical film, indie",,,,
daniel's daughter,2008.0,"romantic drama, romance film, drama, television movie",,,,
daniele cortis,1947.0,drama,,,,
danielle steel's 'palomino',1997.0,"romance film, drama",,,,
danielle steel's a perfect stranger,1994.0,"romantic drama, romance film, television movie, drama, film adaptation",,,,
danielle steel's star,1993.0,"romance film, drama",,,,
danielle steel's the ring,1996.0,"romantic drama, romance film, film adaptation, drama, television movie",,,,
danielson: a family movie,2006.0,"rockumentary, indie, documentary",,,,
danika,2006.0,"thriller, drama, horror, psychological thriller",,,,
danny,2002.0,"comedy-drama, drama, comedy",,,,
danny boy,1934.0,musical,,,,
danny boy,1941.0,drama,,,,
danny boy,1946.0,"drama, adventure",,,,
danny collins,2015.0,,10000000.0,,,
danny deckchair,2003.0,"romantic comedy, indie, world cinema, comedy, romance film, fantasy comedy",,,,
danny jones,1972.0,drama,,,,
danny roane: first time director,2006.0,"parody, mockumentary, comedy",,,,
danny the dog,2005.0,,43000000.0,,,
"danny, the champion of the world",1989.0,"sports, comedy-drama, ""childrens/family""",,,,
dans la peau de jacques chirac,2006.0,documentary,,,,
dans la vie tout s'arrange,1952.0,comedy film,,,,
"dans le silence, je sens rouler la terre",2010.0,documentary,,,,
dans paris,2006.0,"romance film, family drama, drama, world cinema",,,,
danse serpentine,1896.0,"short film, silent film",,,,
dansöz,2001.0,drama,,,,
dante 01,2008.0,"science fiction, prison, world cinema",,,,
dante's inferno,1924.0,"silent film, horror, black-and-white",,,,
dante's inferno,1935.0,"drama, black-and-white",,,,
dante's inferno,2007.0,"parody, indie, animation, drama, comedy, film adaptation",,,,
dante's inferno - abandon all hope,2010.0,short film,,,,
dante's inferno animated,2011.0,"short film, animation",,,,
dante's inferno documented,2012.0,"fantasy, family film, drama",,,,
dante's peak,1997.0,"thriller, adventure, doomsday film, action/adventure, disaster, action",115000000.0,,,
dante’s inferno: an animated epic,2010.0,"horror, action, fantasy, animation",,,,
danton,1931.0,drama,,,,
danton,1983.0,"art film, world cinema, drama, biographical film, political drama, courtroom drama",,,,
"danyel waro, fyer bâtard",2002.0,documentary,,,,
dao,1995.0,"martial arts film, drama, chinese movies",,,,
daphne and the diplomat,1937.0,comedy film,,,,
daphne and the pirate,1916.0,"silent film, indie, costume adventure, black-and-white, drama, action, adventure",,,,
dar alanda kısa paslaşmalar,2000.0,drama,,,,
dar la cara,1962.0,"drama, black-and-white",,,,
daraar,1996.0,bollywood,,,,
darby and joan,1937.0,drama,,,,
darby o'gill and the little people,1959.0,"fantasy, family film, drama, adventure",,,,
darby's rangers,1958.0,"war film, black-and-white, combat films",,,,
darclee,1961.0,drama,,,,
dard,1981.0,"crime fiction, bollywood",,,,
dard,1947.0,"musical, drama, family film",,,,
dard divorce,2007.0,"horror, indie",,,,
dard ka rishta,1982.0,drama,,,,
dare,2009.0,"lgbt, drama, psychological thriller, indie",,,,
dare not walk alone,2006.0,"culture & society, biography, indie, history, political cinema, documentary",,,,
dare to dream: the story of the u.s. women's soccer team,2005.0,sports,,,,
dare to love me,2008.0,"musical, romance film",,,,
daredevil jack,1920.0,"silent film, action, western, black-and-white",,,,
daredevil's time,1977.0,"family film, comedy film",,,,
daredevils of the red circle,1939.0,"action, adventure, black-and-white, movie serial",,,,
daredevils of the west,1943.0,"western, action, adventure, black-and-white",,,,
daresalam,2000.0,"drama, political drama, world cinema, war film",,,,
darfur,2010.0,"thriller, political thriller, action/adventure, drama, war film, action, political drama",,,,
darfur now,2007.0,"culture & society, social issues, documentary",,,,
darinda,2002.0,"thriller, action",,,,
daring game,1968.0,"action, adventure",,,,
darius goes west,2006.0,"indie, documentary",,,,
dariya dil,1988.0,family film,,,,
dark alibi,1946.0,"crime fiction, crime thriller, detective fiction, detective, mystery",,,,
dark and stormy night,2009.0,"thriller, parody, mystery, comedy, indie",,,,
dark angel,1990.0,,7000000.0,,,
dark arc,2004.0,"black comedy, comedy, indie",,,,
dark at noon,1993.0,"fantasy, comedy",,,,
dark blood,1993.0,thriller,,,,
dark blue almost black,2006.0,"lgbt, drama, world cinema",,,,
dark blue world,2001.0,"buddy film, action, drama, world cinema, war film",,,,
dark chamber,2007.0,"thriller, crime thriller, horror, slasher",,,,
dark circles,2012.0,horror,,,,
dark city,1998.0,"thriller, mystery, science fiction, neo-noir",27000000.0,,,
dark city,1990.0,drama,27000000.0,,,
dark city,1950.0,"crime fiction, thriller, drama, film noir, crime thriller",27000000.0,,,
dark command,1940.0,"action/adventure, western",,,,
dark corners,2007.0,"thriller, horror, psychological thriller, supernatural",,,,
dark days,2000.0,"culture & society, biography, indie, social issues, documentary",,,,
dark descent,2002.0,"action/adventure, thriller, action, drama",,,,
dark descent of the forgotten empress,2007.0,"disaster, romantic drama, drama, epic, adventure",,,,
dark eyes,1987.0,"romantic drama, romance film, drama",,,,
dark figure of crime,2018.0,,,,,
dark floors,2008.0,"zombie film, monster movie, horror, creature film",,,,
dark forest,2006.0,"zombie film, horror, world cinema",,,,
dark habits,1983.0,"lgbt, world cinema, satire, drama, comedy, black comedy",,,,
dark harbor,1998.0,"thriller, erotic thriller, psychological thriller, mystery, suspense, crime thriller",,,,
dark harvest,2004.0,"horror, slasher",,,,
dark heaven,1965.0,"drama, musical, horror, comedy",,,,
dark heritage,1989.0,"b-movie, horror, slasher",,,,
dark honeymoon,2008.0,"thriller, horror, mystery, drama, crime thriller, slasher",,,,
dark horse,2011.0,"romantic drama, romance film, drama",,,,
dark horse,1992.0,drama,,,,
dark horse,2005.0,"romance film, drama, art film, world cinema, comedy",,,,
dark horse (2016),2016.0,,,,,
dark house,2010.0,"thriller, horror",,,,
dark intruder,1965.0,"mystery, horror",,,,
dark journey,1937.0,"romance film, war film, horror, black-and-white, spy",,,,
dark kingdom: the dragon king,2004.0,"action/adventure, sword and sorcery, fantasy adventure, fantasy, sword and sorcery films",,,,
dark magic,1939.0,"short film, comedy",,,,
dark mansions,1986.0,thriller,,,,
dark matter,2007.0,drama,,,,
dark measures,2009.0,"crime fiction, action, drama",,,,
dark metropolis,2010.0,"science fiction, fantasy",,,,
dark mirror,2009.0,"thriller, horror, indie, supernatural, psychological thriller, crime thriller",,,,
dark mountain,1944.0,"crime fiction, drama, adventure",,,,
dark nature,2009.0,"thriller, crime thriller, suspense",,,,
dark night,2006.0,"drama, romance film, horror",,,,
dark night of the scarecrow,1981.0,"monster movie, television movie, horror, supernatural",,,,
dark obsession,1989.0,"thriller, drama",,,,
dark of the sun,1968.0,"adventure, war film",,,,
dark passage,1947.0,"thriller, crime fiction, drama, crime thriller, romantic drama, film noir",,,,
dark phoenix,2019.0,,350000000.0,,,
dark places,1974.0,horror,,,,
dark planet,2009.0,,,,,
dark planet: visions of america,2004.0,documentary,,,,
dark prince: the true story of dracula,2000.0,"thriller, biographical film, horror",,,,
dark purpose,1964.0,mystery,,,,
dark rainbow,2012.0,"romance film, musical",,,,
dark redemption,1999.0,"short film, science fiction, action, fantasy, adventure",,,,
dark reel,2008.0,"thriller, horror, mystery, drama, crime thriller, slasher",,,,
dark resonance,2010.0,drama,,,,
dark resurrection,2007.0,indie,,,,
dark ride,2006.0,"cult, horror, slasher, teen",,,,
dark rising,2007.0,"action/adventure, action, horror, horror comedy, comedy",,,,
dark river,1990.0,drama,,,,
dark secrets,1923.0,"silent film, drama, indie, black-and-white",,,,
dark shell,2003.0,"psychological thriller, drama, erotica, animation",,,,
dark skies,2013.0,,3500000.0,17418667.0,10439436.0,27858103.0
dark soldier d,2004.0,"action/adventure, science fiction, anime, japanese movies, world cinema",,,,
dark star,1974.0,"parody, thriller, science fiction, indie, cult, drama, comedy, adventure",,,,
dark streets,2008.0,"crime fiction, drama, indie, film noir, neo-noir",,,,
dark streets of cairo,1940.0,"crime fiction, mystery, adventure",,,,
dark tales of japan,2005.0,"japanese movies, horror, world cinema",,,,
dark tide,2011.0,thriller,,,,
dark tower,1987.0,"thriller, horror, supernatural",,,,
dark universe,1993.0,"alien film, science fiction, horror",,,,
dark victory,1939.0,"romantic drama, tragedy, drama, romance film, black-and-white",,,,
dark walker,2003.0,"monster movie, horror, b-movie, teen",,,,
dark water,2005.0,"thriller, drama, horror",60000000.0,,24010000.0,
dark water,2002.0,"thriller, japanese movies, horror, world cinema",60000000.0,,24010000.0,
dark water 2005 re0release,2005.0,,,,,
dark waters,1944.0,"thriller, black-and-white, film noir, psychological thriller",,,,
dark waters,1994.0,"b-movie, horror, supernatural",,,,
dark wings - the mothman chronicle,2009.0,documentary,,,,
dark woods,2009.0,"thriller, suspense, psychological thriller",,,,
dark world,2008.0,"thriller, crime thriller, mystery",,,,
darkdrive,1996.0,"thriller, science fiction, psychological thriller",,,,
darkened room,2002.0,"short film, surrealism, indie",,,,
darkened rooms,1929.0,mystery,,,,
darkening sky,2011.0,"science fiction, horror",,,,
darker than amber,1970.0,"crime fiction, melodrama, mystery, drama, crime thriller, action",,,,
darkest hour,2017.0,,30000000.0,56468410.0,94378797.0,150847207.0
darklands,1998.0,horror,,,,
darklight,2004.0,"thriller, science fiction, television movie",,,,
darkly dawns the duck,1991.0,animation,,,,
darkman,1990.0,"crime fiction, thriller, science fiction, horror, superhero movie, superhero, action/adventure, action",,,,
darkman ii: the return of durant,1995.0,"crime fiction, thriller, science fiction, superhero movie, action/adventure, action",,,,
darkness at noon,1956.0,japanese movies,,,,
darkness in tallinn,1993.0,"thriller, satire, world cinema",,,,
darkon,2006.0,"culture & society, biography, documentary",,,,
darkside blues,1994.0,"science fiction, anime, japanese movies, animation",,,,
darktown revue,1931.0,"short film, musical, comedy, black-and-white, early black cinema",,,,
darling,2010.0,"romance film, drama",,,,
darling,2012.0,romance film,,,,
darling,2007.0,drama,,,,
darling,1965.0,"romantic drama, romance film, drama",,,,
darling,2007.0,"drama, musical, horror, bollywood, world cinema",,,,
darling companion,2012.0,drama,12000000.0,,,
darling darling,2000.0,romance film,,,,
darling lili,1970.0,"thriller, romantic comedy, melodrama, musical, drama, comedy, war film, romance film, musical drama, spy",22000000.0,,,
"darling, how could you!",1951.0,comedy,,,,
darmiyan,1997.0,drama,,,,
darna,1951.0,filipino movies,,,,
darna mana hai,2003.0,"horror, bollywood, world cinema",,,,
"darna, kuno?",1979.0,parody,,,,
darpan chaya,2010.0,drama,,,,
darr,1993.0,"thriller, horror, world cinema, bollywood",,,,
darsanam,1973.0,,,,,
darth vader's psychic hotline,2002.0,"short film, fan film, indie",,,,
daruchini dip,2007.0,romance film,,,,
daruvu,2012.0,action,,,,
darwaaza bandh rakho,2006.0,"comedy, world cinema",,,,
darwaza,1978.0,horror,,,,
darwin,2011.0,"historical fiction, drama, documentary",,,,
darwin's nightmare,2004.0,"culture & society, biography, environmental science, world cinema, political cinema, social issues, documentary",,,,
das arche noah prinzip,1984.0,science fiction,,,,
das boot,1981.0,"thriller, world cinema, history, action/adventure, drama, war film, action",12000000.0,,,
das boxende känguruh,1895.0,"short film, silent film, indie, black-and-white, documentary",,,,
das einfache mädchen,1957.0,"romance film, musical, comedy film",,,,
das erbe,1935.0,propaganda film,,,,
das experiment,2001.0,"thriller, drama",,,,
das fest des huhnes,1992.0,"parody, comedy",,,,
das fliegende klassenzimmer,1973.0,comedy,,,,
das fräulein,2006.0,"drama, indie, world cinema",,,,
das fräulein von scuderi,1955.0,"crime fiction, drama",,,,
das geheimnis der drei dschunken,1965.0,spy,,,,
das geheimnisvolle wrack,1954.0,"family film, adventure",,,,
das grosse spiel,1942.0,sports,,,,
das gäßchen zum paradies,1936.0,"comedy film, drama",,,,
das kleine und das große glück,1953.0,"romance film, drama",,,,
das leben der anderen,2007.0,,2000000.0,,,
das letzte u-boot,1993.0,"japanese movies, drama, war film",,,,
das liebeskonzil,1982.0,,,,,
das lied vom trompeter,1964.0,drama,,,,
das merkwürdige verhalten geschlechtsreifer großstädter zur paarungszeit,1998.0,"romance film, comedy film",,,,
das millionenspiel,1970.0,"thriller, science fiction, action, drama",,,,
das mirakel,1912.0,"short film, silent film, indie, black-and-white",,,,
das mädchen auf dem brett,1967.0,drama,,,,
das mädchen und der staatsanwalt,1962.0,drama,,,,
das rad,2003.0,"stop motion, short film, fantasy, comedy, animation",,,,
das schreckliche mädchen,1990.0,"political cinema, drama, comedy, world cinema, political drama",,,,
das schwarze schaf,1960.0,"crime fiction, comedy",,,,
das siebente jahr,1968.0,drama,,,,
das spielzeug von paris,1925.0,"silent film, indie, black-and-white",,,,
das sündige dorf,1966.0,comedy film,,,,
das sündige dorf,1954.0,comedy film,,,,
das sündige dorf,1940.0,comedy film,,,,
das tal der sieben monde,1966.0,drama,,,,
das tapfere schneiderlein,1956.0,"family film, fantasy",,,,
das testament des dr. mabuse,1932.0,"crime fiction, thriller, horror, art film, world cinema, master criminal films, black-and-white, drama, crime thriller",,,,
das totenschiff,1959.0,adventure,,,,
das verhexte fischerdorf,1962.0,comedy film,,,,
das vermächtnis des inka,1965.0,"western, adventure",,,,
das wandernde bild,1920.0,romance film,,,,
das weisse band: eine deutsche kindergeschichte,2009.0,,18000000.0,,,
das wilde leben,2007.0,"drama, political drama, world cinema",,,,
das zweite schraube-fragment,1985.0,"short film, adventure",,,,
dasarathan,1993.0,,,,,
dasavatharam,2007.0,"action/adventure, disaster, science fiction, tamil cinema, world cinema",,,,
dasepo naughty girls,2006.0,"lgbt, sex comedy, world cinema, musical, satire, comedy, teen",,,,
dash and lilly,1999.0,"romantic drama, period piece, drama, romance film, biopic [feature]",,,,
dashamukha,2012.0,crime fiction,,,,
dasharatham,1989.0,"comedy film, drama",,,,
dashavatar,2008.0,"musical, bollywood, world cinema, animation",,,,
dashyu ratnakar,1962.0,drama,,,,
dastaan,1972.0,"romantic drama, romance film, drama, world cinema",,,,
dastak,1970.0,"world cinema, black-and-white, musical, drama, romantic drama, romance film, bollywood",,,,
dastak,1996.0,"thriller, world cinema",,,,
dasvidaniya,2008.0,"drama, comedy",,,,
date bait,1960.0,drama,,,,
date with an angel,1987.0,"romantic comedy, indie, fantasy, comedy, romance film, fantasy comedy, romantic fantasy, religious film",,,,
date with disaster,1958.0,"crime fiction, drama",,,,
dateline diamonds,1965.0,"crime fiction, indie, musical, drama, comedy, crime thriller",,,,
dating the enemy,1996.0,"sex comedy, romance film, comedy",,,,
dating: do's and don'ts,1949.0,short film,,,,
dattuputhran,1970.0,,,,,
daud,1997.0,"action/adventure, musical, world cinema, bollywood",,,,
daughter from danang,2002.0,"culture & society, biography, war film, interpersonal relationships, documentary",,,,
daughter of darkness,1948.0,thriller,,,,
