Name,Year,Genres,Budget,domestic_gross,foreign_gross,worldwide_gross
thieves and liars,2006.0,"drama, ensemble film, family drama, social problem film, world cinema",,,,
thieves by law,2010.0,"crime fiction, culture & society, biographical film, world cinema, documentary",,,,
thieves like us,1974.0,"crime fiction, crime drama, road movie, americana, drama, romantic drama, romance film, new hollywood",,,,
thieves of fortune,1990.0,"action, drama, adventure",,,,
thieves quartet,1994.0,"crime fiction, drama",,,,
thieves' clothes,1920.0,"short film, silent film, western, black-and-white, indie",,,,
thieves' gold,1918.0,"silent film, western, black-and-white, indie",,,,
thieves' highway,1949.0,"crime fiction, thriller, crime drama, black-and-white, drama, crime thriller, film noir",,,,
thigh line lyre triangular,1961.0,short film,,,,
thilakkam,2003.0,comedy,,,,
thillaanaa mohanambal,1968.0,"romance film, drama",,,,
thillalangadi,2010.0,"short film, action, comedy",,,,
thillana thillana,2003.0,"comedy film, romance film",,,,
thillu mullu,2012.0,romance film,,,,
thillu mullu,1981.0,"comedy, world cinema",,,,
thilothama,1966.0,,,,,
thimiru,2006.0,action,,,,
thin,2006.0,"illnesses & disabilities, culture & society, indie, gender issues, social issues, documentary",,,,
thin ice,1937.0,"comedy, black-and-white",,,,
things,1989.0,horror,,,,
things are tough all over,1982.0,"cult, comedy of errors, comedy",,,,
things behind the sun,2001.0,"drama, indie",,,,
things change,1988.0,"crime fiction, parody, crime comedy, comedy of manners, satire, drama, comedy, gangster film",,,,
things happen at night,1947.0,"mystery, fantasy comedy, horror, comedy",,,,
things that hang from trees,2006.0,drama,,,,
things to come,1936.0,"science fiction, doomsday film, black-and-white, apocalyptic and post-apocalyptic fiction, drama, steampunk",,,,
things to do before you're 30,2004.0,"romantic comedy, lgbt, indie, sports, comedy, gay themed, romance film",,,,
things to do in denver when you're dead,1995.0,"thriller, crime fiction, crime comedy, gangster film, comedy, crime thriller, suspense",15000000.0,,,
things we lost in the fire,2007.0,drama,16000000.0,,,
things you can tell just by looking at her,2000.0,"lgbt, ensemble film, indie, comedy-drama, drama, romantic drama, romance film",,,,
thingyan moe,1985.0,drama,,,,
think big,1990.0,comedy,,,,
"think fast, mr. moto",1937.0,"thriller, detective fiction, detective, black-and-white, mystery, drama, crime thriller, action",,,,
think like a man too,2014.0,,24000000.0,65182182.0,4999246.0,70181428.0
think of me first as a person,2006.0,"short film, documentary",,,,
think tank,2006.0,"sports, comedy, indie",,,,
thinkalazhcha nalla divasam,1985.0,drama,,,,
thinking xxx,2004.0,"culture & society, biography, graphic & applied arts, media studies, documentary",,,,
thinner,1996.0,"cult, film adaptation, horror, supernatural",14000000.0,,,
thir13en ghosts,2001.0,"thriller, mystery, horror, supernatural",,,,
thirakkatha,2008.0,"world cinema, musical, drama, romantic drama, romance film, bollywood",,,,
thiramala,1953.0,romance film,,,,
thiranottam,2005.0,,,,,
third base,1978.0,japanese movies,,,,
third dimensional murder,1941.0,"short film, crime fiction, comedy film, horror",,,,
"third finger, left hand",1940.0,"comedy, black-and-white",,,,
third man on the mountain,1959.0,"drama, family film, family drama, coming of age, adventure",,,,
third man out,2005.0,"lgbt, thriller, detective fiction, detective, gay themed, gay, mystery, gay interest, drama, film adaptation, crime thriller",,,,
third party risk,1954.0,"crime fiction, drama",,,,
third person,2014.0,,,,,
third person singular number,2009.0,"drama, world cinema",,,,
third star,2010.0,"drama, tragicomedy, comedy-drama, comedy",,,,
third time lucky,1948.0,"crime fiction, drama, black-and-white",,,,
third world california,2006.0,documentary,,,,
third world cop,1999.0,"crime fiction, drama, world cinema, crime drama",,,,
thirichadi,1968.0,,,,,
thirst,1949.0,"romantic drama, romance film, drama, world cinema, black-and-white",,,,
thirst,2009.0,"drama, fantasy, romance film, horror, comedy",,,,
thirst,1979.0,"science fiction, horror",,,,
thirteen at dinner,1985.0,"thriller, crime fiction, detective fiction, detective, television movie, mystery, drama, suspense, crime thriller, whodunit",,,,
thirteen conversations about one thing,2001.0,"drama, indie",3000000.0,,,
thirteen ghosts,2001.0,,19000000.0,,,
thirteen hours by air,1936.0,"disaster, action, drama",,,,
thirteen princess trees,2006.0,"drama, coming of age, chinese movies",,,,
thirteen women,1932.0,"thriller, mystery, drama, slasher, black-and-white",,,,
thirty day princess,1934.0,"comedy, black-and-white",,,,
thirty days,1916.0,"short film, silent film, indie, black-and-white, comedy",,,,
thirty million letters,1963.0,"short film, documentary",,,,
thirty seconds over tokyo,1944.0,"combat films, drama, black-and-white, war film",,,,
thirty three,1965.0,comedy film,,,,
thirty two short films about glenn gould,1993.0,"biography, period piece, drama, biopic [feature], music, musical drama",,,,
thiru thiru thuru thuru,2009.0,"romantic comedy, romance film, comedy",,,,
thiruda thiruda,1993.0,"crime fiction, action, drama, comedy",,,,
thiruda thirudi,2003.0,"romance film, comedy",,,,
thirumagan,2006.0,"romance film, drama, musical",,,,
thirumal perumai,1968.0,fantasy,,,,
thirumalai,2003.0,"romantic drama, romance film, drama, world cinema",,,,
thirumanassu,1995.0,drama,,,,
thirumbi paar,1953.0,drama,,,,
thirunakkara perumal,2009.0,,,,,
thiruneelakantar,1939.0,,,,,
thirunelveli,2000.0,drama,,,,
thirupaachi,2005.0,"thriller, romance film, action",,,,
thirupathi,2006.0,action,,,,
thiruppu munai,1989.0,crime fiction,,,,
thiruthalvaadi,1992.0,romance film,,,,
thiruthani,2008.0,action,,,,
thiruttu payale,2006.0,"musical, drama, bollywood, world cinema",,,,
thiruvannamalai,2008.0,action,,,,
thiruvilayadal,1965.0,"family film, drama, musical",,,,
thiruvilayadal aarambam,2006.0,"romantic comedy, world cinema, musical, drama, comedy, romantic drama, romance film, bollywood",,,,
thiruvonam,1975.0,,,,,
this above all,1942.0,"romance film, drama, black-and-white, war film",,,,
this ain't avatar xxx,2010.0,pornographic movie,,,,
this ain't bebop,1989.0,short film,,,,
this angry age,1958.0,drama,,,,
this beautiful city,2007.0,"drama, indie",,,,
this bloody blundering business,1975.0,"short film, documentary",,,,
this boy's life,1993.0,"family drama, period piece, drama, film adaptation, coming of age, biographical film",,,,
this can't be love,1994.0,"comedy film, drama, romance film",,,,
this can't happen here,1950.0,"drama, black-and-white",,,,
this charming girl,2005.0,drama,,,,
this charming man,2002.0,"short film, comedy",,,,
this could be the night,1957.0,"romantic comedy, romance film, comedy, black-and-white",,,,
this day and age,1933.0,"crime fiction, drama, pre-code, black-and-white",,,,
this day's life,1957.0,"drama, japanese movies",,,,
this disaster: live in london,2004.0,music,,,,
this divided state,2005.0,"culture & society, biography, indie, political cinema, political drama, social issues, documentary",,,,
this earth is mine,1959.0,drama,,,,
this film is not yet rated,2006.0,"media studies, film, film & television history, documentary",,,,
this filthy world,2006.0,"film & television history, documentary, indie, film",,,,
this freedom,1923.0,"silent film, drama",,,,
this girl's life,2004.0,"drama, indie",,,,
this gun for hire,1942.0,"thriller, crime fiction, black-and-white, mystery, drama, crime thriller, film noir",,,,
this happy breed,1944.0,"period piece, drama, comedy",,,,
this happy feeling,1958.0,"romantic drama, romance film, drama, comedy",,,,
this is 40,2012.0,,35000000.0,67544505.0,22676677.0,90221182.0
this is cinerama,1952.0,documentary,,,,
this is circumstantial evidence,2004.0,"music, punk rock",,,,
this is elvis,1981.0,"concert film, rockumentary, musical, drama, biopic [feature], documentary",,,,
this is england,2006.0,"crime fiction, indie, period piece, drama, war film, coming of age",2380000.0,,,
this is england '86,2010.0,drama,,,,
this is forty,2012.0,comedy,,,,
this is heaven,1929.0,"comedy film, romance film",,,,
this is it,2009.0,,,,,
this is martin bonner,2013.0,,42000.0,,,
this is my affair,1937.0,"crime fiction, romance film, historical fiction, drama, musical",,,,
this is my element,2007.0,"sports, documentary",,,,
this is my father,1998.0,"indie, world cinema, period piece, drama, romantic drama, romance film",,,,
this is my life,1992.0,"drama, coming of age, comedy-drama, comedy",,,,
this is my street,1964.0,drama,,,,
this is nollywood,2007.0,documentary,,,,
this is not a crocodile tear,2009.0,short film,,,,
this is not a film,2011.0,documentary,,,,
this is not a love song,2003.0,"thriller, buddy film, road-horror, crime drama, mystery, drama, suspense, crime thriller",,,,
this is not a test,1962.0,"action/adventure, thriller, action, doomsday film",,,,
this is not a test,2008.0,"parody, comedy",,,,
this is not what i expected,2017.0,,,,,
this is perth,2009.0,"short film, comedy",,,,
this is spinal tap,1984.0,"parody, mockumentary, indie, cult, musical, satire, comedy",,,,
this is th' life,1914.0,"short film, silent film, indie, black-and-white",,,,
this is the army,1943.0,"romance film, musical, war film, comedy, musical comedy",,,,
this is the end,2013.0,,32000000.0,101470202.0,25068915.0,126539117.0
this is the life,1944.0,"music, comedy film, drama",,,,
this is the life,2008.0,"hip hop movies, documentary",,,,
this is the night,1932.0,"romantic comedy, romance film, comedy, black-and-white",,,,
this is the sea,1997.0,"romantic drama, romance film, drama",,,,
this is tomas,2019.0,,,,,
this is where i leave you,2014.0,,20000000.0,34296320.0,7000000.0,41296320.0
this island earth,1955.0,"science fiction, adventure",,,,
this land is mine,1943.0,"drama, black-and-white, war film",,,,
this life of mine,1950.0,chinese movies,,,,
this little life,2003.0,drama,,,,
this mad world,1930.0,"spy, action, war film",,,,
this man in paris,1939.0,"crime fiction, mystery, comedy",,,,
this man is mine,1946.0,comedy film,,,,
this man is mine,1934.0,romantic drama,,,,
this man is news,1938.0,"crime fiction, mystery, comedy",,,,
this man must die,1969.0,"crime fiction, thriller, drama, psychological thriller, world cinema",,,,
this man's navy,1945.0,"drama, adventure, war film",,,,
this mechanical age,1954.0,"short film, black-and-white, documentary",,,,
this might hurt,2009.0,comedy,,,,
this modern age,1931.0,"romance film, melodrama, drama, black-and-white",,,,
this must be the place,2011.0,"drama, comedy",,,,
this night i will possess your corpse,1967.0,"horror, black-and-white",,,,
this old cub,2004.0,"sports, culture & society, biography, illnesses & disabilities, documentary",,,,
this other eden,1959.0,comedy,,,,
this property is condemned,1966.0,"romantic drama, romance film, melodrama, drama",,,,
this rebel breed,1960.0,"melodrama, drama",,,,
this revolution,2004.0,"thriller, drama, indie, political drama, political thriller",,,,
this side of resurrection,2011.0,"drama, adventure",,,,
this smells bad,2007.0,"thriller, world cinema",,,,
this space between us,1999.0,"romantic comedy, romance film, indie, comedy film",,,,
this sporting life,1963.0,"kitchen sink realism, sports, drama, british new wave, romantic drama, romance film",,,,
this summer at five,1963.0,"romance film, drama",,,,
this sweet sickness,1977.0,"thriller, mystery, romance film, drama, romantic drama",,,,
this thing called love,1929.0,silent film,,,,
this thing of ours,2003.0,"crime fiction, gangster film, crime drama, caper story, drama, crime thriller",2000000.0,,,
this time around,2003.0,"comedy film, romance film",,,,
this time for keeps,1947.0,"romantic comedy, romance film, musical, comedy",,,,
this tiny world,1972.0,"short film, indie, documentary",,,,
this unnameable little broom,1985.0,"short film, stop motion, animation",,,,
this very moment,2003.0,drama,,,,
this was paris,1942.0,"drama, war film",,,,
this way of life,2009.0,"culture & society, biography, world cinema, slice of life story, interpersonal relationships, documentary",,,,
this way out,1916.0,"short film, silent film, indie, black-and-white, comedy",,,,
this way please,1937.0,"musical, comedy, black-and-white",,,,
this way up,2008.0,short film,,,,
this week of grace,1933.0,comedy film,,,,
this weekend,2012.0,"thriller, action",,,,
this woman is dangerous,1952.0,"crime fiction, romance film, drama, black-and-white",,,,
this year's blonde,1980.0,drama,,,,
this year's love,1999.0,"romantic comedy, romance film, drama, comedy",,,,
this'll make you whistle,1938.0,"romantic comedy, musical, comedy",,,,
thistledown,1938.0,"musical, romance film",,,,
thithikudhe,2003.0,,,,,
thoda tum badlo thoda hum,2004.0,romantic comedy,,,,
thodakkam,2008.0,drama,,,,
thodarum,1999.0,comedy-drama,,,,
thodasa roomani ho jaayen,1990.0,"drama, musical drama",,,,
thodi kodallu,1957.0,drama,,,,
thodi life thoda magic,2008.0,drama,,,,
thodisi bewafaii,1980.0,"drama, world cinema, bollywood",,,,
thodu dongalu,1981.0,"comedy film, action",,,,
thodu dongalu,1954.0,drama,,,,
tholaipesi,2007.0,,,,,
tholi prema,1998.0,romantic comedy,,,,
tholi valapu,2001.0,drama,,,,
tholireyi gadichindi,1977.0,,,,,
thomas & friends: the great discovery,2008.0,"family film, animation",,,,
thomas and the magic railroad,2000.0,"adventure, ""childrens/family"", ""childrens"", ""childrens fantasy"", family film, family-oriented adventure",19000000.0,15933506.0,,
thomas jefferson,1997.0,"history, biography",,,,
thomas l'imposteur,1965.0,drama,,,,
thomas müntzer,1953.0,"drama, war film",,,,
thomas sankara: the upright man,2006.0,"biographical film, documentary",,,,
"thomas, thomas",2010.0,"short film, comedy film, documentary",,,,
thomasine & bushrod,1974.0,"crime fiction, heist, western, action/adventure, blaxploitation, action",,,,
thommante makkal,1965.0,,,,,
thommanum makkalum,2005.0,"action, drama, comedy",,,,
thoondle,2008.0,drama,,,,
thoonga nagaram,2010.0,"thriller, family film, comedy",,,,
thoongadhey thambi thoongadhey,1983.0,"world cinema, musical, drama, romantic drama, romance film, bollywood",,,,
thooral ninnu pochchu,1982.0,"romance film, drama",,,,
thoorpu velle railu,1979.0,,,,,
thoothukudi,2006.0,gangster film,,,,
thooval kottaram,1996.0,"romance film, drama, comedy",,,,
thooval sparsam,1990.0,drama,,,,
thoovalkattu,2010.0,family drama,,,,
thoovanam,2007.0,romance film,,,,
thoovanathumbikal,1987.0,"drama, musical, fantasy",,,,
thoppul kodi,2011.0,drama,,,,
thor and the amazon women,1963.0,"drama, action, fantasy, adventure",,,,
thor: love and thunder,2022.0,,,,,
thor: ragnarok,2017.0,,180000000.0,315058289.0,538918837.0,853977126.0
thor: tales of asgard,2011.0,"superhero, animation, action/adventure, anime, fantasy, action",,,,
thoranai,2009.0,"action, humour",,,,
thoroughbred,1936.0,"crime fiction, sports, drama",,,,
thoroughbreds,2018.0,,5000000.0,,,
thoroughbreds don't cry,1937.0,"musical, drama, adventure",,,,
thoroughly modern millie,1967.0,"parody, romantic comedy, screwball comedy, musical comedy, musical, comedy, romance film",,,,
those awful hats,1909.0,"short film, silent film, drama, indie, black-and-white",,,,
those calloways,1965.0,"family film, family drama, drama, adventure",,,,
those country kids,1914.0,"short film, silent film, indie, black-and-white, comedy",,,,
"those glory, glory days",1984.0,"sports, drama, coming of age, television movie",,,,
those happy days,1914.0,"short film, silent film, indie, black-and-white, comedy",,,,
those kids from town,1942.0,war film,,,,
"those lips, those eyes",1980.0,"romantic comedy, romance film, melodrama, coming of age",,,,
those love pangs,1914.0,"short film, silent film, comedy, black-and-white, indie",,,,
those magnificent men in their flying machines,1965.0,"ensemble film, adventure, costume adventure, action/adventure, adventure comedy, comedy, action",,,,
those merry souls,1985.0,comedy film,,,,
those people next door,1953.0,"comedy-drama, comedy",,,,
those she left behind,1989.0,drama,,,,
those terrible twins,1925.0,silent film,,,,
those three french girls,1930.0,"musical, comedy",,,,
those we love,1932.0,"pre-code, drama",,,,
those were the days,1997.0,comedy,,,,
those were the days,2000.0,chinese movies,,,,
those were the days,1996.0,chinese movies,,,,
those were the days,1995.0,"mystery, drama",,,,
those were the days,1934.0,"comedy, black-and-white",,,,
those were the days...,1995.0,chinese movies,,,,
those were wonderful days,1934.0,"short film, family film, comedy, animation",,,,
those who love,1926.0,silent film,,,,
those who love,1929.0,drama,,,,
those who love me can take the train,1998.0,"lgbt, romance film, drama, world cinema",,,,
those who make tomorrow,1946.0,japanese movies,,,,
those who wish me dead,2021.0,,,,,
those wonderful movie cranks,1978.0,comedy film,,,,
those wonderful years that sucked,1997.0,"ensemble film, drama, comedy",,,,
those young girls,1984.0,adult,,,,
thoth,2001.0,"culture & society, biography, indie, short film, musical, music, documentary",,,,
thotta,2008.0,,,,,
thotta chinungi,1995.0,"romance film, drama",,,,
thottal poo malarum,2007.0,musical,,,,
thottavadi,1973.0,,,,,
thotti jaya,2005.0,thriller,,,,
thottilla,1972.0,,,,,
thou fool,1926.0,"silent film, drama",,,,
thou shalt fly without wings,1978.0,"short film, documentary",,,,
thou shalt honor thy wife,1925.0,"silent film, drama, indie, black-and-white, comedy",,,,
thou shalt not kill... except,1985.0,"thriller, action thrillers, horror, action/adventure, war film, action, slasher",,,,
thou shalt not lie,1915.0,"short film, silent film, drama, black-and-white",,,,
though none go with me,2006.0,"romantic drama, period piece, drama, film adaptation",,,,
thoughtcrimes,2003.0,"crime fiction, crime thriller, drama, psychological thriller, television movie",,,,
thousand pieces of gold,1990.0,"romance film, period piece, drama, western, romantic drama",,,,
thousands cheer,1943.0,"musical, comedy",,,,
thozha,2008.0,musical,,,,
thozhar pandian,1994.0,"musical, drama",,,,
thr3e,2007.0,"thriller, christian film, world cinema, psychological thriller, mystery, drama, film adaptation, crime thriller",2400000.0,,,
thralls,2004.0,"thriller, horror, indie, supernatural, creature film, erotic thriller, teen",,,,
thrashin',1986.0,"action, drama",,,,
threads,1984.0,"doomsday film, nuclear warfare, drama, war film, disaster, dystopia",,,,
threads 0 our tapestry of love,2020.0,,,,,
threat,2006.0,"crime fiction, drama, indie",,,,
three,2002.0,"mystery, horror, chinese movies, world cinema",,,,
three,2010.0,"romance film, drama, comedy",,,,
three,1965.0,"drama, war film",,,,
three against the world,1988.0,chinese movies,,,,
three ages,1923.0,"parody, romantic comedy, silent film, indie, epic, black-and-white, fantasy, comedy, drama",,,,
three and out,2008.0,"black comedy, indie, comedy",,,,
three arabian nuts,1951.0,"short film, fantasy comedy, comedy, black-and-white, slapstick",,,,
three bewildered people in the night,1987.0,lgbt,,,,
"three billboards outside ebbing, missouri",2017.0,,12000000.0,54513740.0,105678175.0,160191915.0
three blind mouseketeers,1936.0,"short film, family film, comedy film, musical, animation",,,,
three blondes in his life,1961.0,"thriller, mystery, drama",,,,
three brave men,1956.0,"drama, docudrama",,,,
three brothers,1981.0,"drama, world cinema",,,,
three businessmen,1998.0,"fantasy comedy, comedy-drama, satire, fantasy, drama",,,,
three came home,1950.0,"film adaptation, docudrama, war film, drama, black-and-white, biopic [feature]",,,,
three can play that game,2007.0,"romantic comedy, romance film, comedy",,,,
three cases of murder,1955.0,"crime fiction, mystery, horror, drama, black-and-white",,,,
three coins in the fountain,1954.0,"romance film, drama",,,,
three colors: blue,1993.0,"mystery, drama, world cinema, music",,,,
three colors: red,1994.0,"romantic drama, romance film, drama, world cinema",,,,
three colors: white,1994.0,"world cinema, mystery, drama, comedy, romantic drama, black comedy, romance film",,,,
three comrades,1938.0,"drama, black-and-white",,,,
three crowns of the sailor,1983.0,"drama, fantasy, world cinema",,,,
three daring daughters,1948.0,musical,,,,
three dark horses,1952.0,"short film, comedy, black-and-white",,,,
three days,2001.0,"family film, fantasy",,,,
three days,2012.0,"comedy film, drama, documentary",,,,
three days,1997.0,drama,,,,
three days,1999.0,"musical, indie, documentary",,,,
three days and a child,1967.0,"drama, black-and-white",,,,
three days of the condor,1975.0,"thriller, mystery, suspense, political thriller, new hollywood, spy",,,,
three dollars,2005.0,"drama, comedy-drama, comedy",,,,
three fables of love,1962.0,drama,,,,
three faces east,1930.0,drama,,,,
three faces west,1940.0,"adventure, family drama, black-and-white, action/adventure, drama, romantic drama, romance film",,,,
three fingered jenny,1916.0,"short film, mystery",,,,
three for all,1975.0,"comedy film, musical",,,,
"three for bedroom ""c""",1952.0,"travel, comedy",,,,
three for the road,1987.0,"drama, indie, comedy",,,,
three for the show,1955.0,"musical, comedy, dance",,,,
three friends,1913.0,"short film, western, silent film, black-and-white, indie",,,,
three from buttermilk village,1978.0,"short film, animation",,,,
three fugitives,1989.0,"chase movie, action/adventure, comedy, comedy of errors, action, slapstick",,,,
three girls about town,1941.0,"comedy, black-and-white",,,,
three girls from rome,1952.0,"drama, black-and-white",,,,
three girls in paris,1963.0,family film,,,,
three girls lost,1931.0,"drama, black-and-white",,,,
three godfathers,1936.0,"western, black-and-white",,,,
three godfathers,1948.0,"action/adventure, western, christmas movie",,,,
three good friends,1930.0,"romance film, comedy film, musical",,,,
three guys named mike,1951.0,"romantic comedy, romance film, comedy",,,,
three hams on rye,1950.0,"short film, comedy, black-and-white",,,,
three hats for lisa,1965.0,"musical, comedy",,,,
three heroes and the navel of the earth,2023.0,,,,,
three heroes on distant shores,2012.0,,,,,
three hollywood girls,1931.0,"short film, comedy, black-and-white",,,,
three hours,1927.0,drama,,,,
three hours to love,1968.0,romance film,,,,
three idiots,2009.0,"world cinema, musical, drama, comedy, romance film, bollywood",,,,
three in one,1957.0,drama,,,,
three in the attic,1968.0,"drama, comedy",,,,
three into two won't go,1969.0,"romance film, drama",,,,
three is a family,1944.0,comedy,,,,
three jumps ahead,1923.0,"western, silent film, black-and-white",,,,
three kingdoms,2008.0,,,,,
three kingdoms: resurrection of the dragon,2008.0,"world cinema, epic, action/adventure, period piece, martial arts film, war film, historical epic, action, chinese movies",20000000.0,,,
three kings,1999.0,"crime fiction, adventure, gulf war, comedy-drama, action/adventure, drama, comedy, war film",48000000.0,,,
three kings,2011.0,comedy film,48000000.0,,,
three little beers,1935.0,"short film, comedy, black-and-white",,,,
three little bops,1957.0,musical,,,,
three little pigs,1933.0,"short film, musical, comedy, family film, animation",,,,
three little pigskins,1934.0,"short film, comedy, black-and-white, slapstick",,,,
three little pirates,1946.0,"short film, comedy, black-and-white, slapstick",,,,
three little sew and sews,1939.0,"short film, comedy, black-and-white, slapstick",,,,
three little twirps,1943.0,"short film, comedy, black-and-white",,,,
three little words,1950.0,"musical, biopic [feature]",,,,
three live ghosts,1929.0,comedy film,,,,
three live ghosts,1922.0,"silent film, indie, black-and-white, comedy",,,,
three lives,1924.0,"gender issues, culture & society, silent film, biography",,,,
three lives and only one death,1996.0,"crime fiction, experimental film, comedy film, comedy of manners, comedy-drama, avant-garde",,,,
three loan wolves,1946.0,"short film, comedy, black-and-white",,,,
three loves has nancy,1938.0,"romantic comedy, romance film, comedy, black-and-white",,,,
three maxims,1936.0,"romantic drama, drama",,,,
three men and a baby,1987.0,"remake, family film, buddy film, comedy, domestic comedy",,,,
three men and a cradle,1985.0,"comedy of manners, comedy, world cinema, domestic comedy",,,,
three men army,1995.0,"romance film, comedy film",,,,
three men in a boat,1920.0,"silent film, comedy film",,,,
three men in a boat,1933.0,comedy,,,,
three men in a boat,1956.0,"romance film, comedy, animation",,,,
three men in a tub,1938.0,"short film, family film, comedy, black-and-white",,,,
three men on a horse,1936.0,"comedy, black-and-white",,,,
three men on fire,1986.0,"crime fiction, thriller, action",,,,
three minute moments,2007.0,"romance film, drama, comedy",,,,
three missing links,1938.0,"short film, comedy, black-and-white",,,,
three monkeys,2008.0,"thriller, ensemble film, melodrama, world cinema, mystery, drama",,,,
three monks,1982.0,"short film, chinese movies, animation",,,,
three mounted men,1918.0,"silent film, western, indie, black-and-white",,,,
three naked sisters: lewdness,2006.0,japanese movies,,,,
three nights of love,1964.0,drama,,,,
three o'clock high,1987.0,"comedy, teen",,,,
three of a kind,1925.0,silent film,,,,
three of a kind,2004.0,"romantic comedy, world cinema, drama, comedy, romantic drama, romance film, chinese movies",,,,
three of hearts,1993.0,"lgbt, romantic comedy, sex comedy, comedy-drama, gay, gay interest, drama, comedy, gay themed, romantic drama, romance film",,,,
three of hearts: a postmodern family,2005.0,"lgbt, culture & society, biography, interpersonal relationships, family & personal relationships, documentary",,,,
three on a couch,1966.0,"romantic comedy, comedy, slapstick",,,,
three on a limb,1936.0,"short film, comedy, black-and-white",,,,
three on a match,1932.0,"pre-code, black-and-white",,,,
three on a meathook,1972.0,"b-movie, horror, slasher",,,,
three on a spree,1961.0,comedy,,,,
